{
  "schema_version": "edge-llm-base/v1",
  "base_id": "qwen35-0.8b-text@2fc06364",
  "source": {
    "model_id": "Qwen/Qwen3.5-0.8B",
    "revision": "2fc06364715b967f1860aea9cf38778875588b17",
    "config_sha256": "b90b86f35c8e6925ef74ee04d0e758f0a845c83a42089ad82bbaa948de9b4204",
    "tokenizer_sha256": "5f9e4d4901a92b997e463c1f46055088b6cca5ca61a6522d1b9f64c4bb81cb42",
    "tokenizer_config_sha256": "49e2b6e395f959f077f1e992b338919c0d4a9732fc6e613995e06557f843500c",
    "artifacts": [
      {
        "path": "model.safetensors-00001-of-00001.safetensors",
        "sha256": "04b1c301231dd422b8860db31311ab2721511346a32cb1e079c4c4e5f1fe4696",
        "bytes": 1746942600
      },
      {
        "path": "model.safetensors.index.json",
        "sha256": "d8a08838a613b025eb7952ed9db11696213e57e76a375661ef5c12f9dd5dcf4e",
        "bytes": 50900
      },
      {
        "path": "chat_template.jinja",
        "sha256": "273d8e0e683b885071fb17e08d71e5f2a5ddfb5309756181681de4f5a1822d80",
        "bytes": 7755
      },
      {
        "path": "merges.txt",
        "sha256": "a9d356d7bdf1ef4949e3e748e95b8e10ad9d4e2e838eddc38a0a7b6b94d1db8d",
        "bytes": 3353259
      },
      {
        "path": "vocab.json",
        "sha256": "ce99b4cb2983d118806ce0a8b777a35b093e2000a503ebde25853284c9dfa003",
        "bytes": 6722759
      }
    ]
  },
  "model": {
    "loader": "transformers.AutoModelForCausalLM",
    "architecture": "Qwen3_5ForCausalLM",
    "model_type": "qwen3_5_text",
    "modality": "text_only",
    "parameter_count": 752393024,
    "num_hidden_layers": 24,
    "hidden_size": 1024
  },
  "lora_policy": {
    "format": "peft-safetensors",
    "peft_type": "LORA",
    "task_type": "CAUSAL_LM",
    "max_rank": 64,
    "allowed_target_modules": [
      "q_proj",
      "k_proj",
      "v_proj",
      "o_proj",
      "gate_proj",
      "up_proj",
      "down_proj"
    ],
    "allow_modules_to_save": false
  },
  "decision_protocol": {
    "name": "single_token_action/v1",
    "max_input_tokens": 128,
    "max_output_tokens": 1,
    "thinking": false,
    "slots": [
      {"slot": "A", "token": "A", "token_id": 32},
      {"slot": "B", "token": "B", "token_id": 33},
      {"slot": "C", "token": "C", "token_id": 34},
      {"slot": "D", "token": "D", "token_id": 35},
      {"slot": "E", "token": "E", "token_id": 36},
      {"slot": "F", "token": "F", "token_id": 37},
      {"slot": "G", "token": "G", "token_id": 38},
      {"slot": "H", "token": "H", "token_id": 39}
    ],
    "reserved_slots": {
      "G": "abstain",
      "H": "request_cloud"
    }
  },
  "deployment_gates": {
    "max_system_ram_mb": 1536,
    "max_mean_closed_loop_ms": 200,
    "min_valid_output_rate": 0.99
  }
}
